Source,Pre,Pro,Post
"prose,Iordanes","dispensatoris eius beneficio libros ipsos antehac relegi. </s><s> quorum quamvis verba non recolo, sensus tamen et res actas","credo","me integre retinere. </s><s> ad quos et ex nonnullis historiis Grecis ac Latinis addedi convenientia, initium finemque et"
"prose,Iordanes","increscere: mari tardo circumfluam, quod nec remis facile inpellentibus cedat, nec ventorum flatibus intumescat,","credo",", quia remotae longius terrae causas motibus negant: quippe illic latius quam usquam aequor extenditur. </s><s> refert autem"
"prose,Iordanes","dixi, gepanta pigrum aliquid tardumque designat, pro gratuito convicio Gepidarum nomen exortum est, quod nec ipsud","credo","falsissimum: sunt etenim tardioris ingenii et graviores corporum velocitate, hi ergo Gepidae tacti invidia, dum"
"prose,Iordanes","ut pelagus aestimant, pedibus transierunt mox quoque Scythica terra ignotis apparuit, cerva disparuit quod,","credo",", spiritus illi, unde progeniem trahunt, ad Scytharum invidia id egerunt. </s><s> illi vero, qui praeter Meotidam alium"
"prose,Cicero, Marcus Tullius","dici se desiderant Atticos aut ipsi Attice volunt dicere, ut mirentur hunc maxime, quo ne Athenas quidem ipsas magis","credo","fuisse Atticas; quid enim sit Atticum discant eloquentiamque ipsius viribus, non imbecillitate sua metiantur. </s><s> Nunc"
"prose,Cicero, Marcus Tullius","spiritum sine ulla commutatione obtinebis? </s><s> Demosthenes quidem, cuius nuper inter imagines tuas ac tuorum, quod eum","credo","amares, cum ad te in Tusculanum venissem, imaginem ex aere vidi, nil Lysiae subtilitate cedit, nihil argutiis et"
"prose,Cicero, Marcus Tullius","a quibusdam sero iam emendatur antiquitas, qui haec reprehendunt. </s><s> Nam pro deum atque hominum fidem deorum aiunt. </s><s> Ita","credo","hoc illi nesciebant: an dabat hanc consuetudo licentiam? </s><s> Itaque idem poeta qui inusitatius contraxerat: patris mei"
"prose,Cicero, Marcus Tullius","me hercule quam me hercules. </s><s> Non scire quidem barbarum iam videtur, nescire dulcius. </s><s> Ipsum meridiem cur non medidiem? </s><s>","Credo",", quod erat insuavius. </s><s> Vna praepositio est af, quae nunc tantum in accepti tabulis manet ac ne his quidem omnium, in"
"prose,Cicero, Marcus Tullius","; inquiunt. </s><s> Quid si antiquissima illa pictura paucorum colorum magis quam haec iam perfecta delectet, illa nobis sit","credo","repetenda, haec scilicet repudianda! </s><s> Nominibus veterum gloriantur. </s><s> Habet autem ut in aetatibus auctoritatem"
"prose,Cicero, Marcus Tullius","boni, quibus illi excellunt, quam in conclusione sententiarum, quam non habent. </s><s> LI. </s><s> Post inventa conclusio est, qua","credo","usuros veteres illos fuisse, si iam nota atque usurpata res esset; qua inventa omnis usos magnos oratores videmus. </s><s> Sed"
"prose,Iustinus Iunianus, Marcus",". </s><s> Interea Darius in gratiam victoris a cognatis suis aureis conpedibus catenisque in vico Parthorum Thara vincitur,","credo","ita diis immortalibus iudicantibus, ut in terra eorum, qui successuri imperio erant, Persarum regnum finiretur. </s>"
"prose,Cicero, Marcus Tullius","multis et aut nulla aut humili aliqua arte praeditis gratuito civitatem in Graecia homines impertiebant, Reginos","credo","aut Locrensis aut Neapolitanos aut Tarentinos, quod scenicis artificibus largiri solebant, id huic summa ingeni"
"prose,Cicero, Marcus Tullius",", dulcedine quadam gloriae commoti, quasi participes eiusdem laudis, magno illud clamore approbaverunt? </s><s> Itaque,","credo",", si civis Romanus Archias legibus non esset, ut ab aliquo imperatore civitate donaretur perficere non potuit. </s><s> Sulla"
"prose,Cicero, Marcus Tullius","non esset, ut ab aliquo imperatore civitate donaretur perficere non potuit. </s><s> Sulla cum Hispanos donaret et Gallos,","credo","hunc petentem repudiasset: quem nos in contione vidimus, cum ei libellum malus poeta de populo subiecisset, quod"
"prose,Cicero, Marcus Tullius","sapiens ille qui inire viam doceret. </s><s> '' Redite viam. </s><s> '' Eodem duce redibant. </s><s> Haec iam tum apud illos barbatos ridicula,","credo",", videbantur, homines, cum recte atque in loco constitissent, iuberi abire ut, unde abissent, eodem statim redirent. </s>"
"prose,Cicero, Marcus Tullius","adimenda est quae liberalitatem magis significat quam largitionem. </s><s> At enim te ad accusandum res publica adduxit. </s><s>","Credo",", Cato, te isto animo atque ea opinione venisse; sed tu imprudentia laberis. </s><s> Ego quod facio, iudices, cum amicitiae"
"prose,Cicero, Marcus Tullius","ac potissimum minimum fratrem, qui est in isto genere urbanissimus; qui te amat plurimum, qui propter nescio quam,","credo",", timiditatem et nocturnos quosdam inanes metus tecum semper pusio cum maiore sorore cubitavit. </s><s> Eum putato tecum"
"prose,Cicero, Marcus Tullius","superati et oppressi. </s><s> Si, qui ob aliquod emolumentum suum cupidius aliquid dicere videntur, eis credi non convenit,","credo","maius emolumentum Caepionibus et Metellis propositum fuisse ex Q. Pompei damnatione, cum studiorum suorum"
"prose,Cicero, Marcus Tullius","sit quaedam tacita de vobis pudoris ac religionis et, cum disceditis, ea diligenter conservata ac retenta videatur. </s><s>","Credo","haec eadem Indutiomarum in testimonio timuisse aut cogitavisse, qui primum illud verbum consideratissimum nostrae"
"prose,Cicero, Marcus Tullius","loco vita illam mulierem spoliari quam pudicitia maluisse. </s><s> sed refugit statim nec de pudicitia plura dixit veritus,","credo",", ne quem inridendi nobis daret et iocandi locum. </s><s> constat enim illam cum deformitate summa fuisse, tum etiam senectute"
"prose,Cicero, Marcus Tullius","ab eodem Cn. Pompeio civitate donati, quorum tamen omnium laudatione utimur, ignoscent alii viri boni ex Sardinia;","credo","enim esse quosdam. </s><s> neque ego, cum de vitiis gentis loquor, neminem excipio; sed a me est de universo genere dicendum, in"
"prose,Seneca, Lucius Annaeus","sciam, et contumaciter quaeram. </s><s> Non enim me cuiquam emancipavi, nullius nomen fero; multum magnorum virorum iudicio","credo",", aliquid et meo vindico. </s><s> Nam illi quoque non inventa sed quaerenda nobis reliquerunt, et invenissent forsitan"
"prose,Seneca, Lucius Annaeus","parietem habet: incommodis illarum caret, voluptatibus fruitur. </s><s> Has laudes eius ipse novi: esse illam totius anni","credo","; occurrit enim Favonio et illum adeo excipit ut Bais neget. </s><s> Non stulte videtur elegisse hunc locum Vatia in quem otium"
"prose,Seneca, Lucius Annaeus","scire quam nihil. </s><s> Illi non praeferunt lumen per quod acies derigatur ad verum, hi oculos mihi effodiunt. </s><s> Si Protagorae","credo",", nihil in rerum natura est nisi dubium; si Nausiphani, hoc unum certum est, nihil esse certi; si Parmenidi, nihil est"
"prose,Seneca, Lucius Annaeus","capi. </s><s> Hanc philosophiam fuisse illo rudi saeculo quo adhuc artificia deerant et ipso usu discebantur utilia non","credo",". </s><s> Sicut aut fortunata tempora, cum in medio iacerent beneficia naturae promiscue utenda, antequam avaritia atque"
"prose,Cicero, Marcus Tullius",". </s><s> quid, si in prima contentione vi tribunicia victus in foro cum multis bonis viris concidissem? </s><s> senatum consules,","credo",", vocassent, quem totum de civitate delerant; ad arma vocassent, qui ne vestitu quidem defendi rem publicam sissent; a"
"prose,Cicero, Marcus Tullius","obsessum teneret? </s><s> haec ut efficere posset, quae fieri nisi armis oppressa re publica nullo modo poterant, idcirco,","credo",", manum sibi P. Sestius et copias comparavit. </s><s> '' at nondum erat maturum; nondum res ipsa ad eius modi praesidia viros"
"prose,Cicero, Marcus Tullius","? </s><s> cui bene dixit umquam bono? </s><s> bene dixit? </s><s> immo quem fortem et bonum civem non petulantissime est insectatus? </s><s> qui, ut","credo",", non libidinis causa, sed ut plebicola videretur, libertinam duxit uxorem. </s><s> is de me suffragium tulit, is adfuit, is"
"prose,Cicero, Marcus Tullius",". </s><s> quae res hominem impellit ut sit tam intemperans iste nimia gloriae cupiditate? </s><s> familiam gladiatoriam,","credo",", nactus est speciosam, nobilem, gloriosam; norat studia populi, videbat clamores et concursus futuros. </s><s> hac"
"prose,Tertullianus, Quintus Septimius Florens",", qui non amicorum solummodo matrimonia usurpant, sed et sua amicis patientissime subministrant---- ex illa,","credo",", maiorum et sapientissimorum disciplina, Graeci Socratis et Romani Catonis, qui uxores suas amicis"
"prose,Tertullianus, Quintus Septimius Florens",". </s><s> ; Idem et cum aliquid de veritate sapiebat deos negans, Aesculapio tamen gallinaceum prosecari iam in fine iubebat,","credo",", ob honorem patris eius, quia Socratem Apollo sapientissimum omnium cecinit. </s><s> O Apollinem inconsideratum! </s>"
"prose,Tertullianus, Quintus Septimius Florens","utique fies quod fuisti aliquando, quia aeque non difficile factus es, quod numquam fuisti aliquando. </s><s> Dubitabitur,","credo",", de dei viribus, qui tantum corpus hoc mundi de eo, quod non fuerat, non minus quam de morte vacationis et inanitatis"
"prose,Cassiodorus, Flavius Magnus Aurelius","praeparat mentem ut suum suscipere mereatur auctorem, fidei templum quae se criminibus non concessit hospitio. </s><s>","Credo","divina miseratione provisum ut corpus subderet animae, animam sibi, totumque salutariter ad Deum respiceret"
"prose,Cicero, Marcus Tullius","non legantur? </s><s> Quamquam, si plane sic verterem Platonem aut Aristotelem, ut verterunt nostri poetae fabulas, male,","credo",", mererer de meis civibus, si ad eorum cognitionem divina illa ingenia transferrem. </s><s> sed id neque feci adhuc nec mihi"
"prose,Cicero, Marcus Tullius","scribere? </s><s> quamquam a te ipso id quidem facio provocatus gratissimo mihi libro, quem ad me de virtute misisti. </s><s> Sed ex eo","credo","quibusdam usu venire; ut abhorreant a Latinis, quod inciderint in inculta quaedam et horrida, de malis Graecis Latine"
"prose,Cicero, Marcus Tullius",", quem ad modum affecta nunc est, desiderat? </s><s> ''-- Nihil sane. </s><s> --'' At, si voluptas esset bonum, desideraret. </s><s> ''-- Ita","credo",". </s><s> --'' Non est igitur voluptas bonum. </s><s> '' Hoc ne statuam quidem dicturam pater aiebat, si loqui posset. </s><s> conclusum est enim"
"prose,Cicero, Marcus Tullius","esse in natura rerum tria? </s><s> unum, cum in voluptate sumus, alterum, cum in dolore, tertium hoc, in quo nunc equidem sum,","credo","item vos, nec in dolore nec in voluptate; ut in voluptate sit, qui epuletur, in dolore, qui torqueatur. </s><s> tu autem inter"
"prose,Cicero, Marcus Tullius","aut retinere virtutem. </s><s> nam nec vir bonus ac iustus haberi debet qui, ne malum habeat, abstinet se ab iniuria. </s><s> nosti,","credo",", illud:'' Nemo pius est, qui pietatem-''; cave putes quicquam esse verius. </s><s> nec enim, dum metuit, iustus est, et certe, si"
"prose,Cicero, Marcus Tullius",", ad quos ista referam, et, quamquam aliquid ipse poteram, tamen invenire malo paratiores. </s><s> Familiares nostros,","credo",", Sironem dicis et Philodemum, cum optimos viros, tum homines doctissimos. </s><s> Recte, inquit, intellegis. </s><s> Age sane,"
"prose,Cicero, Marcus Tullius","videremus, surrexit statim. </s><s> deinde prima illa, quae in congressu solemus: Quid tu, inquit, huc? </s><s> a villa enim,","credo",", et: Si ibi te esse scissem, ad te ipse venissem. </s><s> Heri, inquam, ludis commissis ex urbe profectus veni ad vesperum. </s>"
"prose,Cicero, Marcus Tullius",". </s><s> Videamus nunc, quam sint praeclare illa his, quae iam posui, consequentia. </s><s> cum enim hoc sit extremum- sentis enim,","credo",", me iam diu, quod t; low Graeci dicant, id dicere tum extremum, tum ultimum, tum summum; licebit etiam finem pro extremo"
"prose,Cicero, Marcus Tullius","<s> Fatebuntur Stoici haec omnia dicta esse praeclare, neque eam causam Zenoni desciscendi fuisse. </s><s> Alia quaedam dicent,","credo",", magna antiquorum esse peccata, quae ille veri investigandi cupidus nullo modo ferre potuerit. </s><s> Quid enim perversius"
"prose,Cicero, Marcus Tullius","enim, ut vos quoque soletis, fingere aliquid docendi causa si igitur illa cultura vitium in vite insit ipsa, cetera,","credo",", velit, quae ad colendam vitem attinebunt, sicut antea, se autem omnibus vitis partibus praeferat statuatque nihil"
"prose,Cicero, Marcus Tullius","quam bonum''. </s><s> - Nihil ad rem! </s><s> -'' Ne sit sane; at certe gravius. </s><s> nam bonum ex quo appellatum sit, nescio, praepositum ex eo","credo",", quod praeponatur aliis. </s><s> id mihi magnum videtur. </s><s> '' Itaque dicebat plus tribui divitiis a Zenone, qui eas in"
"prose,Cicero, Marcus Tullius",", malum illud non esse, quia turpe non esset, et esse ferendum viro. </s><s> Hic si Peripateticus fuisset, permansisset,","credo",", in sententia, qui dolorem malum dicunt esse, de asperitate autem eius fortiter ferenda praecipiunt eadem, quae"
"prose,Tertullianus, Quintus Septimius Florens","temptationibus munimenta praestruimus. </s><s> Vigilate et orate, inquit, ne incidatis in temptationem. </s><s> et ideo","credo","temptati sunt quoniam obdormierunt, ut adprehensum dominum destituerint et qui cum eo perstiterit et gladio sit usus"
"prose,Cicero, Marcus Tullius",", iuuabit, in uiam deducet. </s><s> Is uero qui nihil alterius causa faciet et metietur suis commodis omnia, uidetis,","credo",", quid sit acturus! </s><s> Quodsi negabit se illi uitam erepturum et aurum ablaturum, numquam ob eam causam negabit quod id"
"prose,Cicero, Marcus Tullius",", et si omnes Athenienses delectarentur tyrannicis legibus, num idcirco eae leges iustae haberentur? </s><s> Nihilo","credo","magis illa quam interrex noster tulit, ut dictator quem uellet ciuium; nominatim; aut indicta causa inpune posset"
"prose,Cicero, Marcus Tullius","philosophorum omnium, qui princeps de re publica conscripsit idemque separatim de legibus; eius;, id; em; mihi","credo","esse faciundum, ut priusquam ipsam legem recitem, de eius legis laude dicam. </s><s> Quod idem et Zaleucum et Charondam"
"prose,Cicero, Marcus Tullius","maiores fuisse duplex, ut ad rei publicae tempus non numquam, ad agendi consilium saepissime pertineret. </s><s> Atticus:","Credo","hercle ita esse, istique rationi potissimum adsentior. </s><s> Sed redde cetera. </s><s> XIV Marcus: Reddam vero, et id si potero"
"prose,Cicero, Marcus Tullius","sacra nocturna tollimus? </s><s> Non enim populo Romano sed omnibus bonis firmisque populis leges damus. </s><s> Atticus: Excipis","credo","illa quibus ipsi initiati sumus. </s><s> Marcus: Ego vero excipiam. </s><s> Nam mihi cum multa eximia divinaque videntur Athenae tuae"
"prose,Cicero, Marcus Tullius","perpetuis et de Manium iure restat. </s><s> Marcus: O miram memoriam Pomponi tuam! </s><s> At mihi ista exciderant. </s><s> Atticus: Ita","credo",". </s><s> Sed tamen hoc magis eas res et memini et specto, quod et ad pontificium ius et ad civile pertinent. </s><s> Marcus: Vero, et a"
"prose,Cicero, Marcus Tullius","de iure parietum aut aquarum aut luminum; ni; si eo quod cum religione coniunctum est? </s><s> Id autem quantulum est! </s><s> De sacris","credo",", de votis, de feriis et de sepulcris, et si quid eius modi est. </s><s> Cur igitur haec tanta facimus, cum cetera perparva sint,"
"prose,Cicero, Marcus Tullius","; adligata sacris. </s><s> ;[ Plutarch. </s><s> quaest. </s><s> Rom. </s><s> ]:..., doctum hominem sane, cuius fuit Accius perfamiliaris; sed mensem","credo","extremum anni ut veteres Februarium sic hic Decembrem sequebatur. </s><s> Hostia autem maxima parentare pietatis esse"
"prose,Cicero, Marcus Tullius","'', indicat non qui uratur sepelin, sed qui humetur. </s><s> Atticus: Quid quod post XII in urbe sepulti sunt clari viri? </s><s> Marcus:","Credo","Tite fuisse aut eos quibus hoc ante hanc legem virtutis causa tributum est, ut Poplicolae, ut Tuberto, quod eorum"
"prose,Cicero, Marcus Tullius","modum. </s><s> Marcus: Recte requiris. </s><s> Quos enim ad sumptus progressa iam ista res sit, in C. Figuli sepulcro vidisse[ te]","credo",". </s><s> Minimam olim istius rei fuisse cupiditatem multa extant exempla maiorum. </s><s> Nostrae quidem legis interpretes, quo"
"prose,Ambrosius Mediolanensis","inde esse sublatas, cum me populus eo ire deposceret, direxisse presbyteros; me tamen noluisse ire, sed dixisse:;","credo","in Christo, quod ipse nobiscum faciet imperator. </s><s> ; si haec tyrannidis videntur, habeo arma, sed in Christi nomine:"
"prose,Arnobius","viros, qui ut esse credantur, conparatio forsitan efficiat pessimorum. </s><s> Quinam isti sunt? </s><s> dicite. </s><s> Philosophi,","credo",", qui se esse solos sapientissimos autumant et vi huius nominis supercilium sustulerunt: nempe illi qui cum suis"
"prose,Minucius Felix, Marcus","Iuppiter homicidio colitur, et quod Saturni filio dignum est, mali et noxii hominis sanguine saginatur. </s><s> Ipsum","credo","docuisse sanguinis foedere coniurare Catilinam, et Bellonam sacrum suum haustu humani cruoris imbuere, et"
"prose,Cicero, Marcus Tullius","referebant. </s><s> Magni autem est ingenii sevocare mentem a sensibus et cogitationem ab consuetudine abducere. </s><s> itaque","credo","equidem etiam alios tot saeculis, sed quod litteris exstet, Pherecydes Syrius primus dixit animos esse hominum"
"prose,Cicero, Marcus Tullius","animo ipso animum videre, et nimirum hanc habet vim praeceptum Apollinis, quo monet ut se quisque noscat. </s><s> non enim","credo","id praecipit, ut membra nostra aut staturam figuramve noscamus; neque nos corpora sumus, nec ego tibi haec dicens"
"prose,Cicero, Marcus Tullius","et celeritate motus omnique pulchritudine virtutis vim divinam mentis adgnoscito. </s><s> In quo igitur loco est? </s><s>","credo","equidem in capite, et cur credam adferre possum. </s><s> sed alias, ubi sit animus; certe quidem in te est. </s><s> quae est ei natura? </s>"
"prose,Cicero, Marcus Tullius","sensum. </s><s> LXIV. </s><s> Sed plena errorum sunt omnia. </s><s> trahit Hectorem ad currum religatum Achilles: lacerari eum et sentire,","credo",", putat. </s><s> ergo hic ulciscitur, ut quidem sibi videtur; at illa sicut acerbissimam rem maeret:'' Vidi, videre quod me"
"prose,Cicero, Marcus Tullius","versus? </s><s> non enim adgnosco. </s><s> Dicam hercle; etenim recte requiris. </s><s> Videsne abundare me otio? </s><s> Quid tum? </s><s> Fuisti saepe,","credo",", cum Athenis esses, in scholis philosophorum. </s><s> Vero, ac libenter quidem. </s><s> Animadvertebas igitur, etsi tam nemo erat"
"prose,Cicero, Marcus Tullius","sit: Qui alteri exitium parat, Eum scire oportet sibi paratam pestem ut participet parem. </s><s> Abducet Patricoles,","credo",", ut collocet in cubili, ut vulnus obliget. </s><s> Siquidem homo esset; sed nihil vidi minus. </s><s> Quaerit enim quid actum sit:"
"prose,Cicero, Marcus Tullius","facilius, quod ea ne in malis quidem ponenda censeo. </s><s> Sed traducis cogitationes meas ad voluptates. </s><s> Quas? </s><s> Corporis,","credo",", aut quae propter corpus vel recordatione vel spe cogitentur. </s><s> Num quid est aliud? </s><s> rectene interpretor sententiam"
"prose,Cicero, Marcus Tullius","Epicurei, viri optimi nam nullum genus est minus malitiosum GREEK_WORD, me studiose dicere contra Epicurum. </s><s> Ita","credo",", de honore aut de dignitate contendimus. </s><s> Mihi summum in animo bonum videtur, illi autem in corpore, mihi in virtute,"
"prose,Cicero, Marcus Tullius","maerens errabat AleisIpse suum cor edens, hominum vestigia vitans''; et Nioba fingitur lapidea propter aeternum,","credo",", in luctu silentium, Hecubam autem putant propter animi acerbitatem quandam et rabiem fingi in canem esse conversam. </s>"
"prose,Cicero, Marcus Tullius","aliquis hoc animo, ut narrat Lucilius:'' Occidam illum equidem et vincam, si id quaeritis'' inquit,'' Verum illud","credo","fore: in os prius accipiam ipse Quamgladium in stomacho furi ac pulmonibus sisto. </s><s> Odi hominem, iratus pugno, nec"
"prose,Cicero, Marcus Tullius","; se eius voluptates non desiderare, quibus numquam satiari ille posset, suas eum consequi nullo modo posse. </s><s> Vides,","credo",", ut Epicurus cupiditatum genera divi serit, non nimis fortasse subtiliter, utiliter tamen: partim esse naturales et"
"prose,Cicero, Marcus Tullius","diutius habebat quam fruebatur. </s><s> '' Cur igitur divitiae desiderentur, aut ubi pauper tas beatos esse non sinit? </s><s> Signis,","credo",", tabulis studes. </s><s> Si quis est qui bis delectetur, nonne melius tenues homines fruuntur quam illi qui is abundant? </s><s> Est"
"prose,Cicero, Marcus Tullius","cognoscimus. </s><s> Contempto igitur honore, contempla etiam pecunia quid relinquitur quod extimescendum sit? </s><s> Exilium,","credo",", quod in maxumis malis ducitur. </s><s> Id si propter alienam et offensam populi voluntatem malum est, quam sit ea contemnenda"
"prose,Martinus Bracarensis","huius provinciae regionibus constituti aut exiguam aut paene nullam rectae eruditionis notitiam contigerunt. </s><s>","Credo","autem vestrae beatitudinis fraternitatem nosse quia, eo tempore quo in his regionibus nefandissima Priscillianae"
"prose,Curtius Rufus, Quintus","; tempora somni artiora quam noctis sunt. </s><s> Iam Thessali equites et Acarnanes Aetolique, invicta bello manus, fundis,","credo",", et hastis igne duratis repellentur! </s><s> Pari robore opus est: in illa terra quae hos genuit auxilia quaerenda sunt;"
"prose,Curtius Rufus, Quintus",". </s><s> Ceterum tantae fortunae proditorem dei ultores celeriter debita poena persecuti sunt. </s><s> Namque unus e consciis eius,","credo",", regis vicem etiam in illa sorte reveritus, interfecti proditoris caput ad Dareum tulit, opportunum solacium"
"prose,Curtius Rufus, Quintus","didicit. </s><s> Coloniae certe eius paene orbe toto diffusae sunt: Carthago in Africa, in Boeotia Thebae, Gades ad Oceanum. </s><s>","Credo","libero commeantes mari saepiusque adeundo ceteris incognitas terras elegisse sedes iuventuti, qua tunc abundabant"
"prose,Curtius Rufus, Quintus","solacium est nosse sortem suam. </s><s> Num, quod maxime suspicor, et loqui timeo, ludibria meorum nuntiaturus es mihi et, ut","credo",", ipsis quoque omni tristiora supplicio? </s><s> ; Ad haec Tyriotes:; Istud quidem procul abest,; inquit;; quantuscumque"
"prose,Curtius Rufus, Quintus","eodem, quo antea fuit, perseveravit. </s><s> Non vox ulla excidit et, non oris color vultusve mutatus est. </s><s> Sedit inmobilis,-","credo",", praecoci gaudio verita inritare fortunam, adeo ut, quid mallet, intuentibus eam fuerit incertum. </s><s> Inter haec"
"prose,Curtius Rufus, Quintus","unius absunt. </s><s> Ac ne totam quidem urbem tectis occupaverunt,- per LXXX stadia habitabatur,- nec omnia continua sunt,","credo",", quia tutius visum est pluribus locis spargi. </s><s> Cetera serunt coluntque, ut, si externa vis ingruat, obsessis alimenta"
"prose,Curtius Rufus, Quintus","adsunt, quos facilius quae dicam percepturos arbitror, si eadem lingua fuero usus qua tu egisti, non ob aliud,","credo",", quam ut oratio tua intellegi posset a pluribus. </s><s> ; Tum rex:; Ecquid videtis, adeo etiam sermonis patrii Philotan"
"prose,Curtius Rufus, Quintus","velle ipsos ad eum mandata perferre. </s><s> Admissi in tabernaculum iussique considere in vultu regis defixerant oculos;","credo",", quis magnitudine corporis animum aestimantibus modicus habitus haudquaquam famae par videbatur. </s><s> Scythis autem"
"prose,Curtius Rufus, Quintus","patrio more panem,- hoc erat apud Macedonas sanctissimum coeuntium pignus,- quem divisum gladio uterque libabat. </s><s>","Credo","eos, qui gentis mores condiderunt, parco et parabili victu ostendere voluisse iungentibus opes, quantulo contenti"
"prose,Curtius Rufus, Quintus",", sua sponte fortuitorum germinum fruges humo nutriente. </s><s> Lauri bacaeque et multa in illis rupibus agrestis est silva. </s><s>","Credo","equidem non divino instinctu, sed lascivia esse provectos, ut passim hederae ac vitium folia decerperent,"
"prose,Curtius Rufus, Quintus","illis animalibus ad venandum cupiditatem ingenerasse naturam memoriae proditum est! </s><s> Equidem plura transcribo quam","credo",": nam nec adfirmare sustineo, de quibus dubito, nec subducere, quae accepi. </s><s> Relicto igitur Sophite in suo regno ad"
"prose,Curtius Rufus, Quintus",". </s><s> Itaque ad spoliandum corpus, qui vulneraverat, alacer gaudio accurrit; quem ut inicere corpori suo manus sensit,","credo",", ultimi dedecoris indignitate commotus linquentem revocavit animum et nudum hostis latus subiecto mucrone hausit. </s>"
"prose,Curtius Rufus, Quintus","spem gratiae cito abrumpere ad bellum civile properantium est. </s><s> Altera legatione an mitigari possint experiamur. </s><s> Et","credo","nondum regis corpore sepulto ad praestanda ei iusta omnis esse coituros. </s><s> Quod ad me attinet, reddere hoc imperium malo"
"prose,Quintilianus, Marcus Fabius",": nec ipse ad extremam usque anxietatem et ineptas cavillationes descendendum atque his ingenia concidi et comminui","credo",". </s><s> Sed nihil ex grammatice nocuerit nisi quod supervacuum est. </s><s> An ideo minor est M. tullius orator quod idem artis huius"
"prose,Quintilianus, Marcus Fabius","breve tempus continui lusus et totius diei discursus, quia pondus illis abest nec se ipsi gravant: sic animi quoque,","credo","quia minore conatu moventur nec suo nisu studiis insistunt sed formandos se tantummodo praestant, non similiter"
"prose,Quintilianus, Marcus Fabius","aetatis, sed quantum in studiis iam effecerit. </s><s> Et ne diutius disseram quando sit rhetori tradendus, sic optime finiri","credo",": cum poterit. </s><s> Sed hoc ipsum ex superiore pendet quaestione. </s><s> Nam si grammatices munus usque ad suasorias prorogatur,"
