Source,Pre,Pro,Post
"prose,Quintilianus, Marcus Fabius","suspicione. </s><s> Haec notanda breviter existimavi. </s><s> Nam ut absit ab ultimis vitiis ipse ac schola ne praecipiendum quidem","credo",". </s><s> Ac si quis est qui flagitia manifesta in eligendo filii praeceptore non vitet, iam hinc sciat cetera quoque, quae ad"
"prose,Quintilianus, Marcus Fabius","illos qui contra disputaverunt non tam id sensisse quod dicerent quam exercere ingenia materiae difficultate","credo","voluisse, sicut Polycraten, cum Busirim laudaret et Clytaemestram: quamquam is, quod his dissimile non esset,"
"prose,Quintilianus, Marcus Fabius","medicinae. </s><s> Circa mensuras et numeros non versabitur? </s><s> Dicamus has geometriae esse partes. </s><s> Equidem omnia fere posse","credo","casu aliquo venire in officium oratoris: quod si non accidet, non erunt ei subiecta. </s><s> Ita sic quoque recte diximus"
"prose,Quintilianus, Marcus Fabius","est. </s><s> Instrumentum voco sine quo formari materia in id quod velimus effici opus non possit. </s><s> Verum hoc ego non artem","credo","egere, sed artificem. </s><s> Neque enim scientia desiderat instrumentum, quae potest esse consummata etiam si nihil faciat"
"prose,Quintilianus, Marcus Fabius","ita ut inventioni iudicium subnecterent, quia primum esset invenire, deinde iudicare. </s><s> Ego porro ne invenisse quidem","credo","eum qui non iudicavit; neque enim contraria communia stulta invenisse dicitur quisquam, sed non vitasse. </s><s> Et Cicero"
"prose,Quintilianus, Marcus Fabius",". </s><s> Quae ne praeterisse viderer, satis habui attingere. </s><s> Ceterum his nec status satis ostendi nec omnis contineri locos","credo",", quod apparebit diligentius legentibus quae de utraque re dicam; erunt enim plura multo quam quae his elementis"
"prose,Quintilianus, Marcus Fabius",", quae velut subiacent his et ad illud quo iudicium continetur, referuntur, saepe in unam cadere plures posse;( etiam","credo","aliquando dubitari quo statu sit utendum cum adversus unam intentionem plura opponuntur, et sicut in colore dicitur"
"prose,Quintilianus, Marcus Fabius","), in iudiciis autem consiliisque secundum condicionem ipsius quae tractabitur rei accommodandam dicendi","credo","rationem. </s><s> Nam et Philippicas Demosthenis isdem quibus habitas in iudiciis orationes video eminere virtutibus, et"
"prose,Quintilianus, Marcus Fabius","Atticorum, et philosophis fere omnibus qui de arte oratoria scriptum aliquid reliquerunt. </s><s> Id sensisse Atticos","credo","quia Athenis adfectus movere etiam per praeconem prohibebatur orator. </s><s> Philosophos minus miror, apud quos vitii loco"
"prose,Quintilianus, Marcus Fabius","parum qui satis perite quae essent probationibus utilia reperirent. </s><s> Quos equidem non contemno, sed hactenus utiles","credo",", ne quid per eos iudici sit ignotum, atque( ut dicam quod sentio) dignos a quibus causam diserti docerentur: qui vero"
"prose,Quintilianus, Marcus Fabius",". </s><s> Adiciunt quidam ethos perpetuum, pathos temporale esse. </s><s> Quod ut accidere frequentius fateor, ita nonnullas","credo","esse materias quae continuum desiderent adfectum. </s><s> Nec tamen minus artis aut usus hi leniores habent, virium atque"
"prose,Quintilianus, Marcus Fabius","? </s><s> Haec dissimulanda mihi non fuerunt, quibus ipse, quantuscumque sum aut fui, pervenisse me ad aliquod nomen ingeni","credo",": frequenter motus sum ut me non lacrimae solum deprenderent, sed paror et veri similis dolor. </s><s> huic diversa virtus quae"
"prose,Quintilianus, Marcus Fabius","iocus qui minus exprobrat quam potest, ut idem dicenti candidato; semper domum tuam colui;, cum posset palam negare,;","credo",";, inquit,; et verum;. </s><s> Interim de se dicere ridiculum est: et, quod in alium si absentem diceretur urbanum non erat,"
"prose,Quintilianus, Marcus Fabius",", ne quid in eloquendo corruptum obscurum sit? </s><s> Referatur oportet ad sensus, qui non docentur. </s><s> Nec multum a iudicio","credo","distare consilium, nisi quod illud ostendentibus se rebus adhibetur, hoc latentibus et aut omnino nondum repertis"
"prose,Quintilianus, Marcus Fabius",". </s><s> Nec tam insolita laus esset prosecuta dicentem si usitata et ceteris similis fuisset oratio. </s><s> Atque ego illos","credo","qui aderant nec sensisse quid facerent nec sponte iudicioque plausisse, sed velut mente captos et quo essent in loco"
"prose,Quintilianus, Marcus Fabius","in eo scripto quod Nero ad senatum misit occisa matre, cum se periclitatum videri vehet:; salvum me esse adhuc nec","credo","nec gaudeo;. </s><s> Melior cum ex contrariis valet:; habeo quem fugiam, quem sequar non habeo;;; quid quod miser, cum loqui"
"prose,Quintilianus, Marcus Fabius","ante hos simplicior adhuc ratio loquendi fuit. </s><s> Ego vero haec lumina orationis velut oculos quosdam esse eloquentiae","credo",". </s><s> Sed neque oculos esse toto corpore velim, ne cetera membra officium suum perdant, et, si necesse sit, veterem illum"
"prose,Quintilianus, Marcus Fabius","confinis vel eadem est qua nunc utimur plurimum. </s><s> Iam enim ad id genus quod et frequentissimum est et exspectari maxime","credo","veniendum est, in quo per quandam suspicionem quod non dicimus accipi volumus, non utique contrarium, ut in eironeiai"
"prose,Quintilianus, Marcus Fabius","infirmiorem esse dicet. </s><s> duo inter se comparativa committimus:; si te, Catilina, comprehendi, si interfici iussero,","credo","erit verendum mihi ne potius hoc omnes boni serius a me quam quisquam crudelius factum esse dicat;. </s><s> sunt et illa non"
"prose,Quintilianus, Marcus Fabius","non tamen eandem esse condicionem sciamus litium ac disputationum, fori et auditorii, praeceptorum et periculorum. </s><s>","Credo","exacturos plerosque, cum tantum esse utilitatis in legendo iudicemus, ut id quoque adiungamus operi, qui sint"
"prose,Quintilianus, Marcus Fabius","Romana dissentiunt. </s><s> Sed et illa ex Latinis conversio multum et ipsa contulerit. </s><s> Ac de carminibus quidem neminem","credo","dubitare, quo solo genere exercitationis dicitur usus esse sulpicius. </s><s> Nam et sublimis spiritus attollere orationem"
"prose,Quintilianus, Marcus Fabius","procul ab ore aut pectore fertur ad nos manus et deinde prona ac paulum prolata laxatur. </s><s> Hoc modo coepisse Demosthenen","credo","in illo pro Ctesiphonte timido summissoque principio, sic formatam Ciceronis manum cum diceret:; si, iudices,"
"prose,Hyginus: Gromaticus","incepto et incrementis] artis ordinem naturalium rerum substituunt et geometricae exercitationi subducunt saepe;","credo",", ut vetustatem reservent speciebus. </s><s> Aliqua quoque cum de agri qualitate aut incurvi aut angularis excurrunt et a"
"prose,Gellius, Aulus","nitoribus splendoribusque auri squaloris inluvies sit contraria. </s><s> Sed de verbo; vexasse; ita responderi posse","credo",":; Vexasse; grave verbum est factumque ab eo videtur, quod est; vehere;, in quo inest vis iam quaedam alieni arbitrii;"
"prose,Gellius, Aulus","ait consuetum, id me arguit, ita plorando, orando, instando atque obiurgando me obtudit, eam uti venderem; nunc","credo","inter suasaequalis et cognatas sermonem serit:; quis vestrarum fuit integra aetatula, quae hoc idem a"
"prose,Gellius, Aulus","ridens iam Favorinus; quid; penus; sit, non ex nostra magis est philosophia quam ex grammatica tua. </s><s> Meministi enim,","credo",", quaeri solitum, quid Vergilius dixerit,; penum struere; vel; longam; vel; longo ordine;; utrumque enim profecto"
"prose,Gellius, Aulus","haec omnia? </s><s> ; Tum Poenus eludens ignaviam inbelliamque militum eius pretiose armatorum:; Satis, plane satis esse","credo","Romanis haec omnia, etiamsi avarissimi sunt. </s><s> ; Nihil prorsum neque tam lepide neque tam acerbe dici potest: rex de"
"prose,Gellius, Aulus","neque; praememordisse; neque; praemomordisse; dicit, sed; praemorsisse;:; nisi fugissem; inquit; medium,","credo",", praemorsisset. </s><s> ; Item Atta in Conciliatrice: ursum se memordisse autumat. </s><s> ; Peposci; quoque, non; poposci;,"
"prose,Gellius, Aulus","facta viva nunc vigent, qui apud gentes solus praestat, eum suus pater cum pallio uno ab amica abduxit. </s><s> His ego versibus","credo","adductum Valerium Antiatem adversus ceteros omnis scriptores de Scipionis moribus sensisse et eam puellam captivam"
"prose,Gellius, Aulus","declinatis, ut non tam poena quam medicina videretur. </s><s> Postea tamen ob pleraque alia delicta idem factitatum esse","credo","per consuetudinem, quasi minus sani viderentur omnes, qui delinquerent. </s><s> Vocabula sunt militaria, quibus instructa"
"prose,Gellius, Aulus",", et apertius, quae fuisse dicturum puto sinuosius atque sollertius, si quis nunc adesset Stoicorum; nosti enim,","credo",", verbum illud vetus et pervolgatum: amathesteron pos eipe kai saphesteron lege. </s><s> ; Atque hinc exorsus de dolore atque"
"prose,Gellius, Aulus","; dixit contra receptum vocabuli genus hoc versu: capitibus nutantis pinos rectosque cupressos. </s><s> Firmior ei,","credo",", et viridior sonus esse vocis visus est; rectos; dicere; cupressos; quam; rectas;. </s><s> Contra vero idem Ennius in annali"
"prose,Gellius, Aulus","est Pacuvianum illud: nam si, quae eventura sunt, provideant, aequiperent Iovi, item Accianum illud:; nil; inquit;","credo","auguribus, qui aures verbis divitantalienas, suas ut auro locupletent domus;. </s><s> Idem Favorinus deterrere volens ac"
"prose,Gellius, Aulus","glorioso; a; littera in; e; mutata per compositi vocabuli morem; dispessis; dicit pro eo, quod est; dispassis;:","credo","ego istoc exemplo tibi esse eundum extra portam, dispessis manibus patibulum cum habebis. </s><s> Milo Crotoniensis,"
"prose,Gellius, Aulus","solus in locis Italiae silvestribus, quercum vidit proxime viam patulis in parte media rimis hiantem. </s><s> Tum experiri,","credo",", etiam tunc volens, an ullae sibi reliquae vires adessent, inmissis in cavernas arboris digitis diducere et"
"prose,Gellius, Aulus","admodum commentationum libros adquisierim, neque scriptum in his inveni nec usquam alioqui Probum scripsisse","credo",". </s><s> ; Petorritum; enim est non ex Graecia dimidiatum, sed totum Transalpibus; nam est vox Gallica. </s><s> Id scriptum est in"
"prose,Gellius, Aulus",", factus ex illo Homeri versu: andra moi ennepe, Mousa, polytropon. </s><s> Illic igitur aetatis et fidei magnae libro","credo",". </s><s> Nam, quod in versu Plautino est:; sectius quam somnia;, nihil in alteras partes argumenti habet. </s><s> Etiamsi veteres"
"prose,Gellius, Aulus","quam somnia;, nihil in alteras partes argumenti habet. </s><s> Etiamsi veteres autem non; inseque;, sed; insece; dixerunt,","credo",", quia erat lenius leviusque, tamen eiusdem sententiae verbum videtur. </s><s> Nam et; sequo; et; sequor; et item; secta; et;"
"prose,Gellius, Aulus","silvam simul omnem, omne pecus flammast, omnia qua video. </s><s> Quinti Catuli versus illi fuerunt: aufugit mi animus;","credo",", ut solet, ad Theotimumdevenit. </s><s> Sic est: perfugium illud habet. </s><s> Quid, si non interdixem, ne illunc"
"prose,Gellius, Aulus","stantes canunt. </s><s> Posuit hoc verbum L. Accius poeta in pragmaticis appellarique; sicinnistas; ait; nebuloso nomine;;","credo","propterea; nebuloso;, quod, sicinnium cur diceretur, obscurum esset. </s><s> Comoedos quispiam et tragoedos et tibicines"
"prose,Gellius, Aulus","consertum, sed magis ferrorem repetunt regnumque petunt, vadunt solida vi. </s><s> Cum hos ego versus Ennianos dixissem,;","credo","; inquit grammaticus; iam tibi. </s><s> Sed tu velim credas mihi Quintum Ennium didicisse hoc non ex poeticae litteris, set ex"
"prose,Celsus, Cornelius Aulus",". </s><s> - Itaque istud luxuriae causa fieri non oportere confiteor: interdum valetudinis causa recte fieri experimentis","credo","cum eo tamen, ne quis, qui valere et senescere volet, hoc cottidianum habeat. </s><s> Qui vomere post cibum volt, si ex facili"
"prose,Celsus, Cornelius Aulus",", si caput fractum est, ex brachio potius sanguinem esse mittendum; si quod in umero vitium est, ex altero brachio:","credo","quia, si quid parum cesserit, opportuniores hic eae partes iniuriae sunt, quae iam male habent. </s><s> Avertitur quoque"
"prose,Celsus, Cornelius Aulus","contriti, item faeni Graeci, aluminis, singulorum P. I; sebi bubuli P. II S. Ad strumam multa malagmata invenio. </s><s>","Credo","autem, quo peius id malum est minusque facile discutitur, eo plura esse temptata, quae in personis varie responderunt"
"prose,Celsus, Cornelius Aulus","premeretur ac locis siccis alium umorem non reperiret, acetum, quod forte se cum habebat, ebibit et liberatus est,","credo",", quoniam id, quamvis refrigerandi vim habet, tamen habet etiam dissupandi; quo fit, ut terra respersa eo spumet. </s>"
"prose,Celsus, Cornelius Aulus","in quibus vulnus facit medicus, non accipit, et in quibus vulneribus ulceribusque plus profici manu quam medicamento","credo","; tum quicquid ad ossa pertinet. </s><s> Quae deinceps exequi adgrediar, dilatisque in aliud volumen ossibus, in hoc cetera"
"prose,Celsus, Cornelius Aulus","Graece vocatur, si medicamentis non cederet, quemadmodum manu curandum esset, apud magnos chirurgos non repperi. </s><s>","Credo","quia res raro ad sanitatem satis proficit, cum aliquid in ipsa curatione tormenti habeat. </s><s> Apud quosdam tamen positum"
"prose,Pedianus, Asconius","cupiditate plerique etiam boni viri deliquerant, deposuerat ne sumptui esset oratio. </s><s> Statim Quis hic M. Piso fuerit","credo","vos ignorare. </s><s> Fuit autem, ut puto iam nos dixisse, Pupius Piso eisdem temporibus quibus Cicero, sed tanto aetate maior"
"prose,Tertullianus, Quintus Septimius Florens",". </s><s> Porro de nobis quos atrocioribus ac pluribus criminibus deputatis, breviora ac leviora elogia conficitis:","credo",", non uultis oneratos, quos omni opere perditos uultis, aut non putatis requirenda quae nostis. </s><s> Hoc ergo perversius,"
"prose,Tertullianus, Quintus Septimius Florens","mundi, non in in- certa descendere. </s><s> Rotunda mundo Platonica forma: quadratum eum angulatumque commentum ab aliis,","credo",", circino rotundo ita collegit, quod sine capite solum credi laborat. </s><s> Sed Epicurus, qui dixerat:; quae super nos,"
"prose,Tertullianus, Quintus Septimius Florens","proceritatem! </s><s> Denique simul coepit et Caelo uox insolescere et ubera Terrae lapilliscere, faciunt nuptias inter se:","credo",", aut Caelum descendit ad sponsam aut Terra ascendit ad sponsum. </s><s> Concepit tamen Terra de Caelo et peperit illa! </s>"
"prose,Tertullianus, Quintus Septimius Florens","quendam divinitatis. </s><s> Perspiciamus itaque causas allegendae mortalitatis in caelum. </s><s> Harum duplicem rationem,","credo",", proferetis. </s><s> Aut enim ille, quisquis id praestans, facit ut habeat uel amminicula uel munimenta uel etiam ornamenta"
"prose,Martinus Bracarensis","praecepta sunt. </s><s> Dicitur et illis verbum veritatis, non tamen ut fiant boni, quod sunt, sed ne fiant mali, quod non sunt. </s><s>","Credo","autem quia bonis plus hoc quod purum, quod sincerum est, placeat. </s><s> Nam Deus noster non tantum dulcibus adorantium se"
"prose,Martinus Bracarensis","bellans:, inquit,. </s><s> Et iterum:. </s><s> Sed fortasse respondetur mihi: Ergo et Deo non agimus gratias, non referimus laudes? </s><s>","Credo",", quia agimus gratias, potest fieri, sed verbo tenus, sed in sinu: Deo privatim gratias agimus, nobis publice; Deo in"
"prose,Cassiodorus, Flavius Magnus Aurelius","eadem parte nihil dicere. </s><s> sed quia et ille alia et nos diversa in opere iam confecto Domino largiente conscripseramus,","credo","quod lector diligens et in hoc opusculo non inutiliter occupetur. </s><s> ille enim scripsit ad divinae legis novum lectorem,"
"prose,Cassiodorus, Flavius Magnus Aurelius","artis accipiat. </s><s> ita utrumque vocabulum argumentationis suae qualitate promeretur. </s><s> nam et pater Augustinus, hac","credo","ratione commonitus, grammaticam atque rethoricam disciplinae nomine vocitavit, Varronem secutus; Felix etiam"
"prose,Cassiodorus, Flavius Magnus Aurelius","in motu, alia in statu ita esse formata, ut tamen nulla eorum praeter ista quae dicta sunt substantiam percepissent;","credo",", trahens hoc initium, ut multi philosophorum fecerunt, ab illa sententia prophetali, quae dicit: omnia Deum mensura"
"prose,Caesar, Caius Iulius","incommoda sunt tegenda, ne spem adversariis augeamus? </s><s> At etiam, ut media nocte proficiscamur, addunt, quo maiorem,","credo",", licentiam habeant, qui peccare conentur. </s><s> Namque huiusmodi res aut pudore aut metu tenentur; quibus rebus nox maxime"
"prose,Caesar, Caius Iulius","sacramento, quo tenemini, respiciatis illud, quod deditione ducis et capitis deminutione sublatum est. </s><s> At,","credo",", si Caesarem probatis, in me offenditis. </s><s> Qui de meis in vos meritis praedicaturus non sum, quae sunt adhuc et mea"
"prose,Tertullianus, Quintus Septimius Florens","defenditur: sicut enim negata carnis resurrectione concutitur, ita vindicata constabilitur. </s><s> Animae autem salutem","credo","retractatu carere: omnes enim fere haeretici eam, quoquo modo volunt, tamen non negant. </s><s> Viderit unus aliqui Lucanus"
"prose,Eucherius Arelas: Sanctus","magis praesenti magnificentia quam futuri praescientia creans, venturis, ut arbitror, eremum sanctis paravit]. </s><s>","Credo",", his illam locupletem in fructibus voluit et pro indulgentioris naturae vice hanc sanctorum dare fecundam, ut sic"
"prose,Eucherius Arelas: Sanctus","stetit; nudata namque rersum refluo aequore operiens, iter eorum cum hoste delevit, totumque in sedibus suis mare,","credo","ne ab eremo Israhel reverteretur, opposuit. </s><s> Aperuit inter aquas viam et circumfusis deinde aquis texit, ut desertum"
"prose,Severus, Sulpicius","paruere. </s><s> purgatus populus veteris legis ritu agebat. </s><s> ceterum Esdram nihil super reficienda urbe egisse comperio,","credo","potiorem curam ratus plebem corruptis moribus reformare. </s><s> Erat ea tempestate apud Babyloniam Neemias minister"
"prose,Egeria","ibi non erat, id est Thomas, qua reuersus est et dicentibus ei aliis apostolis, quia Dominum uidissent, ille dixit: Non","credo",", nisi uidero. </s><s> Hoc lecto fit denuo oratio, benedicuntur cathecumini, item fideles, et reuertuntur unusquisque ad"
"prose,Tertullianus, Quintus Septimius Florens","caput, sed conligant, a fronte quidem protectae, qua proprie autem caput est, renudae; aliae modice linteolis,","credo",", ne caput premant, nec ad aures usque demissis cerebro tenus operiuntur, Misereo; r;, si tam infirmo auditu sunt, ut"
"prose,Tertullianus, Quintus Septimius Florens","atqueita Damascum et Samariam pro mammis subacturus. </s><s> Aliud est, si penes vos infantesin proelia erumpunt,","credo",", ad solem uncti prius dehinc pannis armati et butyrostipendiati, qui ante norint lanciare quam lancinare. </s><s> Enimvero"
"prose,Tertullianus, Quintus Septimius Florens",", id est super maritos et incontinentes; de nuptiis enim uteri et ubera et infantes. </s><s> Et quando finis nubendi? </s><s>","Credo","post finem uiuendi. </s><s> Renuntiemus carnalibus, ut aliquando spiritalia fructificemus. </s><s> Rape occasionem, etsi non"
"prose,Tertullianus, Quintus Septimius Florens","huiusmodi infantiae, ut prius occidatur, ne uiua lanietur. </s><s> De qua sceleris necessitate nec dubitabat,","credo",", Hicesius, iam natis animam superducens ex aeris frigidi pulsu, quia et ipsum uocabulum animae penes Graecos de"
"prose,Tertullianus, Quintus Septimius Florens",", etiamnunc calens matre se priorem prodisse cupiebat. </s><s> O infantem et aemulum et ualidum et olim contentiosum,","credo",", quia uiuum. </s><s> Aspice etiam singulares conceptus et quidem monstrosiores, sterilis et uirginis, quae uel hoc ipso"
"prose,Tertullianus, Quintus Septimius Florens","et gratiarum, seuerior in ulciscendo et liberalior in largiendo. </s><s> Quid putas futuram animam homicidae? </s><s> Aliquod,","credo",", pecus lanienae et macello destinatum, ut perinde iuguletur, quia et ipsa iugulauerit, perinde decorietur, quia et"
"prose,Tertullianus, Quintus Septimius Florens","ad Carpocraten: si omnium facinorum debitrix anima est, quis erit inimicus et aduersarius eius intellegendus? </s><s>","Credo",", mens melior, quae illam in aliquid innocentiae inpegerit adigendam rursus ac rursus in corpus, donec in nullo rea"
"prose,Tertullianus, Quintus Septimius Florens","de corpore. </s><s> Vxor hoc prodidit. </s><s> Inimici dormientem nacti pro defuncto cremauerunt. </s><s> Regressa anima tardius,","credo",", homicidium sibi imputauit. </s><s> Ciues Clazomenii Hermotimum templo consolantur. </s><s> Mulier non adit ob notam uxoris. </s>"
"prose,Tertullianus, Quintus Septimius Florens","baptizator praeministrauit nec Christus ipse discipulis demonstrauit? </s><s> Quod hoc Menandri balneum? </s><s> Comicum","credo",". </s><s> Sed cur tam infrequens, tam occultum, quo paucissimi lauant? </s><s> Suspectam enim faciam tantam raritatem securissimi"
"prose,Tertullianus, Quintus Septimius Florens","haeretici tanta praesumptio se artis extollit, ut etiam prophetarum animas ab inferis mouere se spondeant. </s><s> Et","credo",", quia mendacio possunt; nec enim pythonico tunc spiritui minus licuit animam Samuelis effingere post deum mortuos"
"prose,Tertullianus, Quintus Septimius Florens","totam securitatem, quam sibi prospexerat, ex inopinato apprehensus et praesidi oblatus, tormentis dissipatus----","credo","pro fugae castigatione----, dehinc ignibus datus passionem, quam vitarat, misericordiae dei rettulit. </s><s> Quid aliud"
"prose,Tertullianus, Quintus Septimius Florens","spadones pro cupiditate regni caelestis? </s><s> Quodsi saluo matrimonio abstinentia toleratur, quanto magis adempto? </s><s>","Credo","enim difficilius saluum derelinqui, quam amissum non desiderari. </s><s> Durum plane et arduum satis continentia sanctae"
"prose,Tertullianus, Quintus Septimius Florens","laboratis ornatae uideri, frustra peritissimos quosque structores capillaturae adhibetis: Deus uos uelari iubet,","credo","ne quarumdam capita uideantur. </s><s> Atque utinam miserrimus ego in illo die christianae exultationis uel inter calcanea"
"prose,Gregorius Turonensis","cordis hesitatione reteneam, quia scio, peccatis obnoxium per credulitatem puram obtenire posse veniam apud Deum. </s><s>","Credo","ergo in Deum patrem omnipotentem. </s><s> Credo in Iesum Christum, filium eius unicum, dominum nostrum, natum a patre, non"
"prose,Gregorius Turonensis",", peccatis obnoxium per credulitatem puram obtenire posse veniam apud Deum. </s><s> Credo ergo in Deum patrem omnipotentem. </s><s>","Credo","in Iesum Christum, filium eius unicum, dominum nostrum, natum a patre, non factum, non post tempora, sed ante cunctum"
"prose,Gregorius Turonensis","non haberet. </s><s> Illos vero, qui dicunt:'' Erat quando non erat'', execrabiliter rennuo et ab eclesia segregare contestor. </s><s>","Credo","Christum hunc verbum esse patris, per quem facta sunt omnia. </s><s> Hunc verbum carne factum credo, cuius passionem mundus"
"prose,Gregorius Turonensis","segregare contestor. </s><s> Credo Christum hunc verbum esse patris, per quem facta sunt omnia. </s><s> Hunc verbum carne factum","credo",", cuius passionem mundus redemptus est, et humanitatem, non deitatem subiacuisse passione, credo. </s><s> Credo, eum tertia"
"prose,Gregorius Turonensis","carne factum credo, cuius passionem mundus redemptus est, et humanitatem, non deitatem subiacuisse passione,","credo",". </s><s> Credo, eum tertia die resurrexisse, hominem perditum liberasse, ascendisse caelos, sedere a dexteram Patris,"
"prose,Gregorius Turonensis","factum credo, cuius passionem mundus redemptus est, et humanitatem, non deitatem subiacuisse passione, credo. </s><s>","Credo",", eum tertia die resurrexisse, hominem perditum liberasse, ascendisse caelos, sedere a dexteram Patris, venturum ac"
"prose,Gregorius Turonensis","hominem perditum liberasse, ascendisse caelos, sedere a dexteram Patris, venturum ac iudicaturum vivos et mortuos. </s><s>","Credo","sanctum Spiritum a Patre et Filio processisse, non minorem et quasi ante non esset, sed aequalem et semper cum Patre et"
"prose,Gregorius Turonensis","omnipotentia, consempiternum esse essentia et nunquam sine Patre fuisse vel Filio, neque minorem Patri vel Filio. </s><s>","Credo","hanc Trinitatem sanctam in distinctione subsistere personarum, et aliam quidem personam Patris, aliam Fili, aliam"
"prose,Gregorius Turonensis",", aliam Fili, aliam Spiritus sancti. </s><s> In qua Trinitate unam Deitatem, unam potentiam, unam essentiam esse, confiteor. </s><s>","Credo","beatam Mariam, ut virginem ante partum, ita virginem et post partum. </s><s> Credo animam inmortalem, nec tamen partem habere"
"prose,Gregorius Turonensis",", unam essentiam esse, confiteor. </s><s> Credo beatam Mariam, ut virginem ante partum, ita virginem et post partum. </s><s>","Credo","animam inmortalem, nec tamen partem habere Deitatis. </s><s> Et omnia quae a episcopis Nicaene instituta sunt credo"
"prose,Gregorius Turonensis","partum. </s><s> Credo animam inmortalem, nec tamen partem habere Deitatis. </s><s> Et omnia quae a episcopis Nicaene instituta sunt","credo","fideliter. </s><s> De fine vero mundi ea sentio quae a prioribus didici, Antechristum prius esse venturo. </s><s> Antechristus vero"
"prose,Gregorius Turonensis",". </s><s> Cumque in illud caenosum lavacrum vi cogeretur inmergi ac proclamaret:'' Patrem cum Filio ac Spiritum sanctum unius","credo","esse substantiae essentiaeque'', digno aquas unguine cunctas infecit, id est fluxu ventris aspersit. </s><s> Exhinc ad"
"prose,Gregorius Turonensis","substantiam atque deitate cum Patre, hodie quae ego perfero patiatur''. </s><s> Et adiecit:'' Credo Deum Patrem omnipotentem,","credo","Filium Dei Christum Iesum aequalem Patri, credo Spiritum sanctum Patri et Filio consubstantialem atque coaeternum''"
